{
  "branch": "development/stabilization-performance-m16",
  "generated_at": "2026-09-20T22:00:00+02:00",
  "measurement_policy": {
    "behavior_changed": false,
    "live_canary_performed": false,
    "minimum_repeat_samples": 3,
    "missing_evidence_state": "not-measured",
    "percentiles": [
      "p50",
      "p95"
    ]
  },
  "measurements": {
    "artifacts": {
      "evidence": {
        "branch": "development/stabilization-performance-m16",
        "command": "./scripts/check-wheel.sh; ./docker/scripts/build-local.sh <approved-tags>",
        "environment": "local-development-linux-x86_64-python-3.12.3",
        "measured_at": "2026-09-20T22:00:00+02:00",
        "sample_count": 0,
        "source_revision": "09eaa24a3bd6618ae177dcc019b7fd89106e34ea",
        "stored_output_policy": "allowlisted-aggregate-fields-only"
      },
      "reason": "no-M16-wheel-or-image-artifact-built",
      "status": "not-measured",
      "value": null
    },
    "container_runtime": {
      "evidence": {
        "branch": "development/stabilization-performance-m16",
        "command": "docker inspect <approved-non-production-container-set>",
        "environment": "local-development-linux-x86_64-python-3.12.3",
        "measured_at": "2026-09-20T22:00:00+02:00",
        "sample_count": 0,
        "source_revision": "09eaa24a3bd6618ae177dcc019b7fd89106e34ea",
        "stored_output_policy": "allowlisted-aggregate-fields-only"
      },
      "reason": "productive-read-only-canary-requires-separate-explicit-approval",
      "status": "not-measured",
      "value": null
    },
    "identity": {
      "evidence": {
        "branch": "development/stabilization-performance-m16",
        "command": "./scripts/assistant.sh version --verify; .venv/bin/python scripts/source-manifest.py verify; git status --short",
        "environment": "local-development-linux-x86_64-python-3.12.3",
        "measured_at": "2026-09-20T22:00:00+02:00",
        "sample_count": 5,
        "source_revision": "09eaa24a3bd6618ae177dcc019b7fd89106e34ea",
        "stored_output_policy": "allowlisted-aggregate-fields-only"
      },
      "status": "measured",
      "value": {
        "branch": "development/stabilization-performance-m16",
        "current_head": "09eaa24a3bd6618ae177dcc019b7fd89106e34ea",
        "git_status_timing": {
          "maximum": 13.043,
          "minimum": 11.127,
          "p50": 12.634,
          "p95": 13.043,
          "samples": 5,
          "unit": "ms"
        },
        "manifest_entries": 577,
        "manifest_verify_timing": {
          "maximum": 315.287,
          "minimum": 286.06,
          "p50": 296.919,
          "p95": 315.287,
          "samples": 5,
          "unit": "ms"
        },
        "release": "r28",
        "release_verified": true,
        "release_version": "3.4.0-r28",
        "source_manifest_ok": true,
        "source_revision": "09eaa24a3bd6618ae177dcc019b7fd89106e34ea",
        "version_verify_timing": {
          "maximum": 917.735,
          "minimum": 863.009,
          "p50": 891.458,
          "p95": 917.735,
          "samples": 5,
          "unit": "ms"
        }
      }
    },
    "image": {
      "evidence": {
        "branch": "development/stabilization-performance-m16",
        "command": "docker image inspect <approved-m16-image>",
        "environment": "local-development-linux-x86_64-python-3.12.3",
        "measured_at": "2026-09-20T22:00:00+02:00",
        "sample_count": 0,
        "source_revision": "09eaa24a3bd6618ae177dcc019b7fd89106e34ea",
        "stored_output_policy": "allowlisted-aggregate-fields-only"
      },
      "reason": "no-M16-image-built-or-selected",
      "status": "not-measured",
      "value": null
    },
    "invoices": {
      "evidence": {
        "branch": "development/stabilization-performance-m16",
        "command": "./scripts/assistant.sh invoices status",
        "environment": "local-development-linux-x86_64-python-3.12.3",
        "measured_at": "2026-09-20T22:00:00+02:00",
        "sample_count": 0,
        "source_revision": "09eaa24a3bd6618ae177dcc019b7fd89106e34ea",
        "stored_output_policy": "allowlisted-aggregate-fields-only"
      },
      "reason": "productive-read-only-canary-requires-separate-explicit-approval",
      "status": "not-measured",
      "value": null
    },
    "mail_cache_classes": {
      "cold": {
        "evidence": {
          "branch": "development/stabilization-performance-m16",
          "command": ".venv/bin/python scripts/benchmark_mail_acceptance_m118.py",
          "environment": "local-development-linux-x86_64-python-3.12.3",
          "measured_at": "2026-09-20T22:00:00+02:00",
          "sample_count": 5,
          "source_revision": "09eaa24a3bd6618ae177dcc019b7fd89106e34ea",
          "stored_output_policy": "allowlisted-aggregate-fields-only"
        },
        "status": "measured",
        "value": {
          "latency_ms": 6.1167,
          "synthetic": true
        }
      },
      "live": {
        "evidence": {
          "branch": "development/stabilization-performance-m16",
          "command": "./scripts/assistant.sh mail search-local --query <synthetic-probe>",
          "environment": "local-development-linux-x86_64-python-3.12.3",
          "measured_at": "2026-09-20T22:00:00+02:00",
          "sample_count": 0,
          "source_revision": "09eaa24a3bd6618ae177dcc019b7fd89106e34ea",
          "stored_output_policy": "allowlisted-aggregate-fields-only"
        },
        "reason": "productive-read-only-canary-requires-separate-explicit-approval",
        "status": "not-measured",
        "value": null
      },
      "warm": {
        "evidence": {
          "branch": "development/stabilization-performance-m16",
          "command": ".venv/bin/python scripts/benchmark_mail_acceptance_m118.py",
          "environment": "local-development-linux-x86_64-python-3.12.3",
          "measured_at": "2026-09-20T22:00:00+02:00",
          "sample_count": 65,
          "source_revision": "09eaa24a3bd6618ae177dcc019b7fd89106e34ea",
          "stored_output_policy": "allowlisted-aggregate-fields-only"
        },
        "status": "measured",
        "value": {
          "p50_ms": 1.9619,
          "p95_ms": 6.3216,
          "synthetic": true
        }
      }
    },
    "mail_live": {
      "evidence": {
        "branch": "development/stabilization-performance-m16",
        "command": "./scripts/assistant.sh mail index status",
        "environment": "local-development-linux-x86_64-python-3.12.3",
        "measured_at": "2026-09-20T22:00:00+02:00",
        "sample_count": 0,
        "source_revision": "09eaa24a3bd6618ae177dcc019b7fd89106e34ea",
        "stored_output_policy": "allowlisted-aggregate-fields-only"
      },
      "reason": "productive-read-only-canary-requires-separate-explicit-approval",
      "status": "not-measured",
      "value": null
    },
    "mail_synthetic": {
      "evidence": {
        "branch": "development/stabilization-performance-m16",
        "command": ".venv/bin/python scripts/benchmark_mail_acceptance_m118.py --samples 5",
        "environment": "local-development-linux-x86_64-python-3.12.3",
        "measured_at": "2026-09-20T22:00:00+02:00",
        "sample_count": 65,
        "source_revision": "09eaa24a3bd6618ae177dcc019b7fd89106e34ea",
        "stored_output_policy": "allowlisted-aggregate-fields-only"
      },
      "status": "measured",
      "value": {
        "cold_cache_ms": 6.1167,
        "corpus_messages": 13,
        "evaluated_queries": 13,
        "latency_samples": 65,
        "mean_recall_at_10": 0.65,
        "mrr": 0.6667,
        "ok": true,
        "privacy": {
          "embedding_vectors_in_report": false,
          "mail_content_in_report": false,
          "productive_data_read": false,
          "productive_state_written": false,
          "query_text_in_report": false,
          "synthetic_only": true
        },
        "semantic_model_selected": false,
        "warm_cache_p50_ms": 1.9619,
        "warm_cache_p95_ms": 6.3216
      }
    },
    "nextcloud": {
      "evidence": {
        "branch": "development/stabilization-performance-m16",
        "command": "./scripts/assistant.sh nextcloud status",
        "environment": "local-development-linux-x86_64-python-3.12.3",
        "measured_at": "2026-09-20T22:00:00+02:00",
        "sample_count": 0,
        "source_revision": "09eaa24a3bd6618ae177dcc019b7fd89106e34ea",
        "stored_output_policy": "allowlisted-aggregate-fields-only"
      },
      "reason": "productive-read-only-canary-requires-separate-explicit-approval",
      "status": "not-measured",
      "value": null
    },
    "portfolio": {
      "evidence": {
        "branch": "development/stabilization-performance-m16",
        "command": "./scripts/assistant.sh portfolio doctor",
        "environment": "local-development-linux-x86_64-python-3.12.3",
        "measured_at": "2026-09-20T22:00:00+02:00",
        "sample_count": 0,
        "source_revision": "09eaa24a3bd6618ae177dcc019b7fd89106e34ea",
        "stored_output_policy": "allowlisted-aggregate-fields-only"
      },
      "reason": "productive-read-only-canary-requires-separate-explicit-approval",
      "status": "not-measured",
      "value": null
    },
    "quality": {
      "evidence": {
        "branch": "development/stabilization-performance-m16",
        "command": "./scripts/run-tests.sh; ./scripts/check-repo.sh",
        "environment": "local-development-linux-x86_64-python-3.12.3",
        "measured_at": "2026-09-20T22:00:00+02:00",
        "sample_count": 1,
        "source_revision": "09eaa24a3bd6618ae177dcc019b7fd89106e34ea",
        "stored_output_policy": "allowlisted-aggregate-fields-only"
      },
      "status": "measured",
      "value": {
        "collection_items": 1057,
        "coverage": {
          "branch_percent": 55.804,
          "covered_lines": 20855,
          "critical_modules_percent": {